sep=	
884534	Practical Geostatistics: Modelling and Spatial Analysis. By Simon W. Houlding. (Berlin: Springer Verlag, 2000). [Pp. xvi+159+CD-ROMJ]. ISBN: 3-540-66820-9. Hardback.	Margaret A. Oliver		International Journal of Geographical Information Science
884535	All shapes and sizes: the first generation of national spatial data infrastructures.	Ian Masser		International Journal of Geographical Information Science
884536	Spatial variability in classification accuracy of agricultural crops in the Dutch national land-cover database.	Pepijn A. J. van Oort,Arnold Bregt,Sytze de Bruin,Allard J. W. de Wit,Alfred Stein		International Journal of Geographical Information Science
884537	Methods for detecting apparent differences between spatial tessellations at different time points.	Atsushi Masuyama		International Journal of Geographical Information Science
884538	Generic query tool for spatio-temporal data.	Peter van Oosterom,Bart Maessen,Wilko Quak		International Journal of Geographical Information Science
884542	Ellipsoidal quadtrees for indexing of global geographical data.	Patrik Ottoson,Hans Hauska		International Journal of Geographical Information Science
884543	Scale-spaces for generalization of 3D buildings.	Helmut Mayer		International Journal of Geographical Information Science
884544	Analysis of land use drivers at the watershed and household level: Linking two paradigms at the Philippine forest fringe.	Koen Overmars,Peter Verburg		International Journal of Geographical Information Science
884545	GIS for Water Resources and Watershed Management. Edited by John G. Lyon (London: Taylor & Francis, 2002) ISBN 0-415-28607-7.	Colin McClean		International Journal of Geographical Information Science
884546	Spatial Indexing of Large Volume Swath Data Sets.	Bradford G. Nickerson,Feng Gao		International Journal of Geographical Information Science
884547	Calibration of stochastic cellular automata: the application to rural-urban land conversions.	Fulong Wu		International Journal of Geographical Information Science
884549	Possibilities and limits of prospective GIS land cover modelling - a compared case study: Garrotxes (France) and Alta Alpujarra Granadina (Spain).	Martin Paegelow,María Teresa Camacho Olmedo		International Journal of Geographical Information Science
884550	Surfaces: tacit knowledge, formal language, and metaphor at the Harvard Lab for Computer Graphics and Spatial Analysis.	Patrick McHaffie		International Journal of Geographical Information Science
884551	Processing fuzzy spatial queries: a configuration similarity approach.	Dimitris Papadias		International Journal of Geographical Information Science
884552	A framework to enhance semantic flexibility for analysis of distributed phenomena.	John McIntosh,May Yuan		International Journal of Geographical Information Science
884553	Search algorithms for multiway spatial joins.	Dimitris Papadias,Dinos Arkoumanis		International Journal of Geographical Information Science
884554	Calibration and sensitivity analysis of a spatially-distributed solar radiation model.	Daniel W. McKenney		International Journal of Geographical Information Science
884555	Kimberly van Niel, Shawn W. LaffanGambling with randomness: the use of pseudo-random number generators in GIS.	Kimberly van Niel,Shawn W. Laffan		International Journal of Geographical Information Science
884556	SimLand: A Prototype to Simulate Land Conversion Through the Integrated GIS and CA with AHP-Derived Transition Rules.	Fulong Wu		International Journal of Geographical Information Science
884557	Discovering Environmental Data: Metadatabases, Network Information Resource Tools and the GENIE System.	David Medyckyj-Scott,Mike Cuthbertson,Ian Newman		International Journal of Geographical Information Science
884558	Spatial Relations, Minimum Bounding Rectangles, and Spatial Data Structures.	Dimitris Papadias,Yannis Theodoridis		International Journal of Geographical Information Science
884559	A conceptual framework for incorporating cognitive principles into geographical database representation.	Jeremy L. Mennis,Donna Peuquet,Liujian Qian		International Journal of Geographical Information Science
884560	A TIN compression method using Delaunay triangulation.	Dong-Gyu Park,Hwan-Gue Cho,Yang-Soo Kim		International Journal of Geographical Information Science
884562	Swarming methods for geospatial reasoning.	H. Van Dyke Parunak,Sven Brueckner,Robert S. Matthews,John A. Sauter		International Journal of Geographical Information Science
884563	GIS and Geometric Representation in Facility Location Problems.	Harvey J. Miller		International Journal of Geographical Information Science
884566	A new approach to the nearest-neighbour method to discover cluster features in overlaid spatial point processes.	Tao Pei,A-Xing Zhu,Chenghu Zhou,Baolin Li,Chengzhi Qin		International Journal of Geographical Information Science
884567	Modelling River Channel Topography Using GIS.	J. A. Milne,D. A. Sear		International Journal of Geographical Information Science
884569	A software framework to create vector-topology in parallel GIS operations.	Michael J. Mineter		International Journal of Geographical Information Science
884570	A proposed framework for feature-level geospatial data sharing: a case study for transportation network data.	Z.-R. Peng		International Journal of Geographical Information Science
884571	Modelling Topographic Potential for Erosion and Deposition Using GIS.	Helena Mitásová,Jaroslav Hofierka,Maros Zlocha,Louis Iverson		International Journal of Geographical Information Science
884573	Reply to Comment by Desmet and Govers.	Helena Mitásová,Jaroslav Hofierka,Marián Zlocha,Louis Iverson		International Journal of Geographical Information Science
884574	Experimental evaluation of positional accuracy estimates from a linear network using point- and line-based testing methods.	Thomas G. van Niel,Tim R. McVicar		International Journal of Geographical Information Science
884575	Wavelet triangulated irregular networks.	Jingsong Wu,Kevin Amaratunga		International Journal of Geographical Information Science
884577	A GIS-based environmental decision support system to assess the transfer of long-lived radiocaesium through food chains in areas contaminated by the Chernobyl accident.	M. van der Perk,J. R. Burema,Peter A. Burrough,A. G. Gillett,M. B. van der Meer		International Journal of Geographical Information Science
884578	An evolutionary algorithm for multicriteria path optimization problems.	Peter Mooney,Adam C. Winstanley		International Journal of Geographical Information Science
884580	The Role of Root-Mean-Square Error in the Geo-Transformation of Images in GIS.	M. Morad,A. I. Chalmers,P. R. O'Regan		International Journal of Geographical Information Science
884581	Active legends for interactive cartographic animation.	Michael P. Peterson		International Journal of Geographical Information Science
884582	Spatial data mining for enhanced soil map modelling.	Christopher J. Moran,Elisabeth N. Bui		International Journal of Geographical Information Science
884583	Integration of multi-source remote sensing data for land cover change detection.	C. C. Petit,E. F. Lambin		International Journal of Geographical Information Science
884584	Spatial representation of economic and financial measures used in agriculture via wavelet analysis.	Mitchel Morehart,Fionn Murtagh,Jean-Luc Starck		International Journal of Geographical Information Science
884586	A global kinetic spatial data structure for a marine simulation.	Mir Abolfazl Mostafavi,Christopher M. Gold		International Journal of Geographical Information Science
884587	A cephalopod fishery GIS for the Northeast Atlantic: development and application.	Graham J. Pierce,Jianjun Wang,Xiaohong Zheng,Jose M. Bellido,Peter R. Boyle,Vencent Denis,Jean-Paul Robin		International Journal of Geographical Information Science
884588	Developing Parallel Procedures for Line Simplification.	James E. Mower		International Journal of Geographical Information Science
884589	Calibrating a neural network-based urban change model for two metropolitan areas of the Upper Midwest of the United States.	Bryan C. Pijanowski,Snehal Pithadia,Bradley Shellito,Konstantinos T. Alexandridis		International Journal of Geographical Information Science
884591	Production of integrated digital terrain model from multiple datasets of different quality.	Tomaz Podobnikar		International Journal of Geographical Information Science
884593	Spatial analysis of rural energy system.	Shaligram Pokharel		International Journal of Geographical Information Science
884594	Cluster Discovery Techniques for Exploratory Spatial Data Analysis.	Alan T. Murray,Vladimir Estivill-Castro		International Journal of Geographical Information Science
884595	A generalized cross-tabulation matrix to compare soft-classified maps at multiple resolutions.	Robert Gilmore Pontius Jr.,Mang Lung Cheuk		International Journal of Geographical Information Science
884596	Integrating attribute and space characteristics in choropleth display and spatial data mining.	Alan T. Murray,Tung-Kai Shyy		International Journal of Geographical Information Science
884597	Comparison of the structure and accuracy of two land change models.	Robert Gilmore Pontius Jr.,Jeffrey Malanson		International Journal of Geographical Information Science
884598	Dynamic simplification and visualization of large maps.	Nabil H. Mustafa,Shankar Krishnan,Gokul Varadhan,Suresh Venkatasubramanian		International Journal of Geographical Information Science
884599	Comparison of the structure and accuracy of two land change models.	Robert Gilmore Pontius Jr.,Jeffrey Malanson		International Journal of Geographical Information Science
884600	Cartographic generalization of roads in a local and adaptive approach: A knowledge acquistion problem.	Sébastien Mustière		International Journal of Geographical Information Science
884601	Characterisation and generalisation of cartographic lines using Delaunay triangulation.	P. M. van der Poorten,Christopher B. Jones		International Journal of Geographical Information Science
884602	Accuracy assessment of probabilistic visibilities.	Kris Nackaerts,Gerard Govers,Jos Van Orshoven		International Journal of Geographical Information Science
884603	Hierarchical fuzzy pattern matching for the regional comparison of land use maps.	Conrad Power,Alvin Simms,Roger White		International Journal of Geographical Information Science
884604	Use of the Weighted Kappa Coefficient in Classification Error Assessment of Thematic Maps.	Erik Næsset		International Journal of Geographical Information Science
884605	Research Article: Dynamic run-time application development using CORBA objects and XML in the field of distributed GIS.	Michael Preston,Peter Clayton,George Wells		International Journal of Geographical Information Science
884606	A Prototype Graphic Landscape Analysis System: Part 1. Predicting Spatial Patterns of Grazing Pressure Using GIS.	Jerry C. Namken,Jerry W. Stuth		International Journal of Geographical Information Science
884607	Modelling error propagation in vector-based buffer analysis.	Wenzhong Shi,Chui Kwan Cheung,Changqing Zhu		International Journal of Geographical Information Science
884608	A Generic Statistical Approach for Modelling Error of Geometric Features in GIS.	Wenzhong Shi		International Journal of Geographical Information Science
884610	Discrete Visibility Problems and Graph Algorithms.	Enrico Puppo,Paola Marzano		International Journal of Geographical Information Science
884612	The role of sub-national government and the private sector in future spatial data infrastructures.	Abbas Rajabifard,Andrew Binns,Ian Masser,Ian Williamson		International Journal of Geographical Information Science
884613	Use of LDAP to partially implement the OGIS discovery service.	Steve Ramroop,Richard Pascoe		International Journal of Geographical Information Science
884615	Assessing vulnerability to earthquake hazards through spatial multicriteria analysis of urban areas.	Tarek Rashed,John Weeks		International Journal of Geographical Information Science
884616	Aoristic Crime Analysis.	Jerry H. Ratcliffe,Michael J. McCullagh		International Journal of Geographical Information Science
884617	Aoristic analysis: the spatial interpretation of unspecific temporal events.	Jerry H. Ratcliffe		International Journal of Geographical Information Science
884618	On the accuracy of TIGER-type geocoded address data in relation to cadastral and census areal units.	Jerry H. Ratcliffe		International Journal of Geographical Information Science
884619	Geocoding crime and a first estimate of a minimum acceptable hit rate.	Jerry H. Ratcliffe		International Journal of Geographical Information Science
884620	Robustness in GIS algorithm implementation with application to line simplification.	Helmut Ratschek,Jon G. Rokne,M. Leriger		International Journal of Geographical Information Science
884621	Ontology and epistemology for agent-based wayfinding simulation.	Martin Raubal		International Journal of Geographical Information Science
884622	Creating a hydrographic network from its cartographic representation: a case study using Ordnance Survey MasterMap data.	Nicolas Regnauld,William A. Mackaness		International Journal of Geographical Information Science
884623	Implementing a new data model for simulating processes.	Femke Reitsma,Jochen Albrecht		International Journal of Geographical Information Science
884624	Accuracy of discontinuous binary surfaces: a case study using boreal forest fires.	Tarmo K. Remmel,Ajith H. Perera		International Journal of Geographical Information Science
884625	A commentary on GeoVRML: a tool for 3D representation of georeferenced data on the web.	Theresa-Marie Rhyne		International Journal of Geographical Information Science
884626	Application of GIS to investigate the use of space in coral reef fish: a comparison of territorial behaviour in two Red Sea butterflyfishes.	D. Righton,C. Mills		International Journal of Geographical Information Science
884627	Artificial neural networks as a tool for spatial interpolation.	Juan P. Rigol,Claire H. Jarvis,Neil Stuart		International Journal of Geographical Information Science
884629	Analysing forest fragmentation using spatial autocorrelation, graphs and GIS.	Steven A. Roberts,G. Brent Hall,Paul H. Calamai		International Journal of Geographical Information Science
884630	An example of decision support for trypanosomiasis control using a geographical information system in eastern Zambia.	T. P. Robinson,R. S. Harris,J. S. Hopkins,B. G. Williams		International Journal of Geographical Information Science
884631	Restoring Continuity: Exploration of Techniques for Reconstructing the Spatial Distribution Underlying Polygonized Data.	Jennifer M. Robinson,Ezra Zubrow		International Journal of Geographical Information Science
884632	Parallel Polygon Line Shading: The Quest for More Computational Power from an Existing GIS Algorithm.	Stephen C. Roche,Bruce M. Gittings		International Journal of Geographical Information Science
884633	Comparing geospatial entity classes: an asymmetric and context-dependent similarity measure.	M. Andrea Rodríguez,Max J. Egenhofer		International Journal of Geographical Information Science
884634	The Geography of Elderly Minority Populations in the United States.	Peter A. Rogerson		International Journal of Geographical Information Science
884636	Quantifying Soil Variability in GIS Applications: II Spatial Distribution of Soil Properties.	Andrew S. Rogowski		International Journal of Geographical Information Science
884637	Data quality and model complexity for regional scale soil erosion prediction.	Anton J. J. van Rompaey,Gerard Govers		International Journal of Geographical Information Science
884638	A strategy for controlling error of distributed environmental models by aggregation.	Anton J. J. van Rompaey,Gerard Govers,Mark Baudet		International Journal of Geographical Information Science
884639	A Method vor Building Displacement in Automated Map Generalisation.	Anne Ruas		International Journal of Geographical Information Science
884640	Utility Network Derivation from Legacy Source Data for Feature-Based AM/FM Systems.	David J. Russomanno		International Journal of Geographical Information Science
884641	Accuracy of count data transferred through the areal weighting interpolation method.	Yukio Sadahiro		International Journal of Geographical Information Science
884642	Analysis of surface changes using primitive events.	Yukio Sadahiro		International Journal of Geographical Information Science
884643	Stability of the surface generated from distributed points of uncertain location.	Yukio Sadahiro		International Journal of Geographical Information Science
884644	Accuracy of quantized Voronoi diagrams.	Yukio Sadahiro,Takashi Tominaga		International Journal of Geographical Information Science
884645	GIS-based route planning in landslide-prone areas.	Ashis Kumar Saha,Manoj K. Arora,Ravi Prakash Gupta,M. L. Virdi,Elmar Csaplovics		International Journal of Geographical Information Science
884646	Implementation of GIS in India: Organizational and Implications.	Sundeep Sahay,Geoff Walsham		International Journal of Geographical Information Science
884647	A feature-based approach to conflation of geospatial sources.	Ashok Samal,Sharad C. Seth,Kevin Cueto		International Journal of Geographical Information Science
884648	Concepts and Techniques of Geographic Information Systems. By C. P. Lo and Albert K. W. Yeung. (Upper Saddle River, New Jersey: Prentice Hall, 2002). [Pp. xii+492]. ISBN: 0-13-080427-4. Hardback.	Jochen Schiewe		International Journal of Geographical Information Science
884649	Comparison of polynomial models for land surface curvature calculation.	Jochen Schmidt,Ian Evans S.,Johannes Brinkmann		International Journal of Geographical Information Science
884651	Agent-based modelling environment for spatial decision support.	Raja R. Sengupta,David A. Bennett		International Journal of Geographical Information Science
884652	Knowledge acquisition for the automatic interpretation of spatial data.	Monika Sester		International Journal of Geographical Information Science
884653	Optimization approaches for generalization and data abstraction.	Monika Sester		International Journal of Geographical Information Science
884655	Natural-Language Spatial Relations Between Linear and Areal Objects: The Topology and Metric of English-Language Terms.	A. Rashid B. M. Shariff,Max J. Egenhofer,David M. Mark		International Journal of Geographical Information Science
884656	Fractal dimension and fractal growth of urbanized areas.	Guoqiang Shen		International Journal of Geographical Information Science
884657	3D simulation of soft geo-objects.	Dayong Shen,Kaoru Takara,Yasuto Tachikawa,Yuling Liu		International Journal of Geographical Information Science
884658	Geographies of the information society.	Eric Sheppard,Helen Couclelis,Stephen Graham,J. W. Harrington,Harlan Onsrud		International Journal of Geographical Information Science
884659	Fuzzy Representation of Geographical Boundaries in GIS.	Fangju Wang,G. Brent Hall		International Journal of Geographical Information Science
884660	A stochastic process-based model for the positional error of line segments in GIS.	Wenzhong Shi,Wenbao Liu		International Journal of Geographical Information Science
884661	A spatio-temporal data model for activity-based transport demand modelling.	Donggen Wang,Tao Cheng		International Journal of Geographical Information Science
884662	Development of Voronoi-based cellular automata -an integrated dynamic model for Geographical Information Systems.	Wenzhong Shi,Matthew Yick Cheung Pang		International Journal of Geographical Information Science
884663	An efficient method for identifying and filling surface depressions in digital elevation models for hydrologic analysis and modelling.	L. Wang,H. Liu		International Journal of Geographical Information Science
884664	A hybrid interpolation method for the refinement of a regular grid digital elevation model.	John Wenzhong Shi,Y. Tian		International Journal of Geographical Information Science
884665	Comparison of existing triangulation methods for regularly and irregularly spaced height fields.	Kai Wang,Chor-Pang Lo,George A. Brook,Hamid R. Arabnia		International Journal of Geographical Information Science
884666	An object-oriented data model for complex objects in three-dimensional geographical information systems.	Wenzhong Shi,Bisheng Yang,Qingquan Li		International Journal of Geographical Information Science
884667	Automated map generalization with multiple operators: a simulated annealing approach.	J. Mark Ware,Christopher B. Jones,Nathan Thomas		International Journal of Geographical Information Science
884669	Natural Trees - Neighbourhood-Location in a Nutshell.	David F. Watson,Alistair I. Mees		International Journal of Geographical Information Science
884670	Geometric variability of raster cell class assignment.	Ashton M. Shortridge		International Journal of Geographical Information Science
884671	A Computerised Decision Support System for Rural Policy Formulation.	Philip M. Watson,Richard A. Wadsworth		International Journal of Geographical Information Science
884672	Geometric probability and GIS: some applications for the statistics of intersections.	Ashton M. Shortridge,Michael F. Goodchild		International Journal of Geographical Information Science
884673	A comparison of two methods to create tracks of moving objects: linear weighted distance and constrained random walk.	Elizabeth A. Wentz,Aimee F. Campbell,Robert Houston		International Journal of Geographical Information Science
884674	Conforming (to) the opposition: the social construction of geographical information systems in social movements.	R. E. Sieber		International Journal of Geographical Information Science
884675	Modeling mobile individuals in dynamic landscapes.	James D. Westervelt		International Journal of Geographical Information Science
884676	Classification of Kangaroo Habitat Distribution Using Three GIS Models.	Andrew K. Skidmore,Alison Gauld,Paul A. Walker		International Journal of Geographical Information Science
884677	Comparing Area and Shape Distortion on Polyhedral-Based Recursive Partitions of the Sphere.	Denis White,A. Jon Kimerling,Kevin Sahr,Lian Song		International Journal of Geographical Information Science
884678	Geographical categories: an ontological investigation.	Barry Smith,David M. Mark		International Journal of Geographical Information Science
884679	Landscape `Contagion' in Raster and Vector Environments.	James D. Wickham,Kurt H. Riitters,Robert V. O'Neill,K. Bruce Jones,Timothy G. Wade		International Journal of Geographical Information Science
884681	Quantifying positional error induced by line simplification.	Howard Veregin		International Journal of Geographical Information Science
884682	Book reviews.			International Journal of Geographical Information Science
884683	Prediction of Anopheles minimus habitat in India - a tool for malaria management.	Aruna Srivastava,B. N. Nagpal,Rekha Saxena,Vas Dev,S. K. Subbarao		International Journal of Geographical Information Science
884685	Book reviews.			International Journal of Geographical Information Science
884686	Automatic extraction of building statistics from digital orthophotos.	Athena Stassopoulou,Terry Caelli,J. Raul Ramirez		International Journal of Geographical Information Science
884687	Embedding landscape processes into triangulated terrain models.	Enrique Vivoni,Vanessa Teles,Valeriy Ivanov,Rafael Bras,Dara Entekhabi		International Journal of Geographical Information Science
884688	Book reviews.			International Journal of Geographical Information Science
884689	Application of a Bayesian Network in a GIS Based Decision Making System.	Athena Stassopoulou,Maria Petrou,Josef Kittler		International Journal of Geographical Information Science
884690	The point-radius method for georeferencing locality descriptions and calculating associated uncertainty.	John Wieczorek,Qinghua Guo,Robert Hijmans		International Journal of Geographical Information Science
884691	Erratum.	Richard Steele		International Journal of Geographical Information Science
884692	An application of problem and product ontologies for the revision of beach nourishments.	Daniel Van de Vlag,Bérengère Vasseur,Alfred Stein,Robert Jeansoulin		International Journal of Geographical Information Science
884693	Book review.			International Journal of Geographical Information Science
884694	Intra-urban location and clustering of road accidents using GIS: a Belgian example.	Therese Steenberghen,T. Dufays,I. Thomas,B. Flahaut		International Journal of Geographical Information Science
884695	Continuing Education and Competency Programmes in GIS.	Thomas A. Wikle		International Journal of Geographical Information Science
884696	Modelling the history of semi-structured geographical entities.	Emmanuel Stefanakis		International Journal of Geographical Information Science
884697	Abstraction and Decomposition in Interoperable GIS.	Agnès Voisard,Heinz Schweppe		International Journal of Geographical Information Science
884699	Point Representation of Spatial Objects and Query Window Extension: A New Technique for Spatial Access Methods.	Emmanuel Stefanakis,Yannis Theodoridis,Timos K. Sellis,Yuk-Cheung Lee		International Journal of Geographical Information Science
884701	A personal construct-based knowledge acquisition process for natural resource mapping.	A-Xing Zhu		International Journal of Geographical Information Science
884702	Incorporating fuzzy set methodologies in a DBMS repository for the application domain of GIS.	Emmanuel Stefanakis,Michalis Vazirgiannis,Timos K. Sellis		International Journal of Geographical Information Science
