sep=	
856207	A cache invalidation scheme for continuous partial match queries in mobile computing environments.	Yon Dohn Chung		Distributed and Parallel Databases
856208	Performance Comparison of Mirrored Disk Scheduling Methods with a Shared Non-Volatile Cache.	Alexander Thomasian,Chang Liu		Distributed and Parallel Databases
856209	Efficient retrieval of replicated data.	Ali Saman Tosun		Distributed and Parallel Databases
856210	Distributed real time database systems: background and literature review.	Udai Shanker,Manoj Misra,Anil Kumar Sarje		Distributed and Parallel Databases
856211	A Secure Agent-based Framework for Internet Trading in Mobile Computing Environments.	Xun Yi,Chee Kheong Siew,Xiao Feng Wang,Eiji Okamoto		Distributed and Parallel Databases
856212	An Overview of Standards and Related Technology in Web Services.	Aphrodite Tsalgatidou,Thomi Pilioura		Distributed and Parallel Databases
856213	Two approaches to the integration of heterogeneous data warehouses.	Riccardo Torlone		Distributed and Parallel Databases
856214	Answering Heterogeneous Database Queries with Degrees of Uncertainty.	Frank Shou-Cheng Tseng,Arbee L. P. Chen,Wei-Pang Yang		Distributed and Parallel Databases
856215	Query optimization via contention space partitioning and cost error controlling for dynamic multidatabase systems.	Qiang Zhu,Jaidev Haridas,Wen-Chi Hou		Distributed and Parallel Databases
856216	Processing Real-Time Transactions in a Replicated Database System.	Özgür Ulusoy		Distributed and Parallel Databases
856217	Indexing views to route queries in a PDMS.	Lefteris Sidirourgos,Giorgos Kokkinidis,Theodore Dalamagas,Vassilis Christophides,Timos K. Sellis		Distributed and Parallel Databases
856218	Evolutionary Techniques for Web Caching.	Athena Vakali		Distributed and Parallel Databases
856219	Self-adapting recovery nets for policy-driven exception handling in business processes.	Rachid Hamadi,Boualem Benatallah,Brahim Medjahed		Distributed and Parallel Databases
856220	Parallel Database Systems: Open Problems and New Issues.	Patrick Valduriez		Distributed and Parallel Databases
856221	PnP: sequential, external memory, and parallel iceberg cube computation.	Ying Chen,Frank K. H. A. Dehne,Todd Eavis,Andrew Rau-Chaplin		Distributed and Parallel Databases
856222	Snowball: Scalable Storage on Networks of Workstations with Balanced Load.	Radek Vingralek,Yuri Breitbart,Gerhard Weikum		Distributed and Parallel Databases
856223	Movement-based checkpointing and logging for failure recovery of database applications in mobile environments.	Sapna E. George,Ing-Ray Chen		Distributed and Parallel Databases
856224	Cross-Organizational Transaction Support for E-Services in Virtual Enterprises.	Jochem Vonk,Paul W. P. J. Grefen		Distributed and Parallel Databases
856225	A survey on the history of transaction management: from flat to grid transactions.	Ting Wang,Jochem Vonk,Benedikt Kratz,Paul W. P. J. Grefen		Distributed and Parallel Databases
856226	An Adaptive Data-Shipping Architecture for Client Caching Data Management Systems.	Kaladhar Voruganti,M. Tamer Özsu,Ronald C. Unrau		Distributed and Parallel Databases
856227	Dynamic composition and optimization of Web services.	Liangzhao Zeng,Anne H. H. Ngu,Boualem Benatallah,Rodion M. Podorozhny,Hui Lei		Distributed and Parallel Databases
856228	Dataflow Query Execution in a Parallel Main-memory Environment.	Annita N. Wilschut,Peter M. G. Apers		Distributed and Parallel Databases
856229	Scalable and topology-aware reconciliation on P2P networks.	Vidal Martins,Esther Pacitti,Manal El Dick,Ricardo Jiménez-Peris		Distributed and Parallel Databases
856230	Updating and Querying Databases that Track Mobile Units.	Ouri Wolfson,A. Prasad Sistla,Sam Chamberlain,Yelena Yesha		Distributed and Parallel Databases
856231	Integrating semantically heterogeneous aggregate views of distributed databases.	Sally I. McClean,Bryan W. Scotney,Philip J. Morrow,Kieran Greer		Distributed and Parallel Databases
856232	Bounded Inconsistency for Type-Specific Concurrency Control.	Man Hon Wong,Divyakant Agrawal,Hang Kwong Mak		Distributed and Parallel Databases
856233	Mobility and Extensibility in the StratOSphere Framework.	Daniel Wu,Divyakant Agrawal,Amr El Abbadi		Distributed and Parallel Databases
856234	Energy-Efficient Mobile Cache Invalidation.	Kun-Lung Wu,Philip S. Yu,Ming-Syan Chen		Distributed and Parallel Databases
856235	Workfile Disk Management for Concurrent Mergesorts in a Multiprocessor Database System.	Kun-Lung Wu,Philip S. Yu,Jen-Yao Chung,James Z. Teng		Distributed and Parallel Databases
856236	Title			Distributed and Parallel Databases
856237	Title			Distributed and Parallel Databases
856238	Parallel Bifold: Large-scale parallel pattern mining with constraints.	Mohammad El-Hajj,Osmar R. Zaïane		Distributed and Parallel Databases
1270597	Partitioning methods for multi-version XML data warehouses.	Laura Irina Rusu,J. Wenny Rahayu,David Taniar		Distributed and Parallel Databases
1270598	Revelation on demand.	Nicolas Anciaux,Mehdi Benzine,Luc Bouganim,Philippe Pucheral,Dennis Shasha		Distributed and Parallel Databases
1270599	Log-based transactional workflow mining.	Walid Gaaloul,Khaled Gaaloul,Sami Bhiri,Armin Haller,Manfred Hauswirth		Distributed and Parallel Databases
1270600	Guest editorial: special issue on physical data warehouse design.	Ladjel Bellatreche		Distributed and Parallel Databases
1270601	Model and procedure for performance and availability-wise parallel warehouses.	Pedro Furtado		Distributed and Parallel Databases
1270602	Semantics and evaluation of top- queries in probabilistic databases.	Xi Zhang,Jan Chomicki		Distributed and Parallel Databases
1270603	Continuously monitoring top- uncertain data streams: a probabilistic threshold method.	Ming Hua,Jian Pei		Distributed and Parallel Databases
1270604	Guest editorial: special issue on ranking in databases.	Ihab F. Ilyas		Distributed and Parallel Databases
1270605	Parallel OLAP query processing in database clusters with data replication.	Alexandre A. B. Lima,Camille Furtado,Patrick Valduriez,Marta Mattoso		Distributed and Parallel Databases
1270606	Adaptive workload allocation in query processing in autonomous heterogeneous environments.	Anastasios Gounaris,Jim Smith,Norman W. Paton,Rizos Sakellariou,Alvaro A. A. Fernandes,Paul Watson		Distributed and Parallel Databases
1270607	Data warehouse access using multi-agent system.	Nader Kolsi,Abdelaziz Abdellatif,Khaled Ghédira		Distributed and Parallel Databases
1270608	Ranking strategies and threats: a cost-based pareto optimization approach.	Youngdae Kim,Gae-won You,Seung-won Hwang		Distributed and Parallel Databases
1270609	Blocking reduction for distributed transaction processing within MANETs.	Sebastian Obermeier,Stefan Böttcher,Martin Hett,Panos K. Chrysanthis,George Samaras		Distributed and Parallel Databases
1270610	Distributed top- aggregation queries at large.	Thomas Neumann,Matthias Bender,Sebastian Michel,Ralf Schenkel,Peter Triantafillou,Gerhard Weikum		Distributed and Parallel Databases
1336615	A cross-layer atomic commit protocol implementation for transaction processing in mobile ad-hoc networks.	Sebastian Obermeier,Stefan Böttcher,Dominik Kleine		Distributed and Parallel Databases
1336612	Efficient range query processing in metric spaces over highly distributed data.	Christos Doulkeridis,Akrivi Vlachou,Yannis Kotidis,Michalis Vazirgiannis		Distributed and Parallel Databases
1336610	Linking identical neighborly partitions for efficient high-dimensional similarity search in unstructured peer-to-peer systems.	Bin Cui,Linhao Xu,Jiakui Zhao		Distributed and Parallel Databases
1336617	On performance evaluation and design of atomic commit protocols for mobile transactions.	Nadia Nouali-Taboudjemat,Fairouz Chehbour,Habiba Drias		Distributed and Parallel Databases
1336614	Rewiring strategies for semantic overlay networks.	Paraskevi Raftopoulou,Euripides G. M. Petrakis,Christos Tryfonopoulos		Distributed and Parallel Databases
1336611	Maintenance strategies for routing indexes.	Katja Hose,Christian Lemke,Kai-Uwe Sattler		Distributed and Parallel Databases
1336618	A preference-based approach for interactive weight learning: learning weights within a logic-based query language.	David Zellhöfer,Ingo Schmitt		Distributed and Parallel Databases
1336616	A graph theoretic approach to authorization delegation and conflict resolution in decentralised systems.	Chun Ruan,Vijay Varadharajan		Distributed and Parallel Databases
1336608	DHTJoin: processing continuous join queries using DHT networks.	Wenceslao Palma,Reza Akbarinia,Esther Pacitti,Patrick Valduriez		Distributed and Parallel Databases
1336613	Guest editorial: special issue on data management in peer-to-peer systems.	Beng Chin Ooi,Kian-Lee Tan		Distributed and Parallel Databases
1336609	Multi-dimensional data density estimation in P2P networks.	Minqi Zhou,Weining Qian,Xueqing Gong,Aoying Zhou		Distributed and Parallel Databases
2919397	Backward validation of communicating complex state machines in web services environments.	Farah Zoubeyr,Abdelkamel Tari,Aris M. Ouksel		Distributed and Parallel Databases
2919401	Modeling and querying provenance by extending CIDOC CRM.	Maria Theodoridou,Yannis Tzitzikas,Martin Doerr,Yannis Marketakis,Valantis Melessanakis		Distributed and Parallel Databases
2919402	Understanding provenance black boxes.	Adriane Chapman,H. V. Jagadish		Distributed and Parallel Databases
2919404	Fault-tolerant query processing in structured P2P-systems.	Markus Bestehorn,Christian von der Weth,Erik Buchmann,Klemens Böhm		Distributed and Parallel Databases
2919400	Distributed stream join query processing with semijoins.	Tri Minh Tran,Byung Suk Lee		Distributed and Parallel Databases
2919399	Maintenance of top- materialized views.	Eftychia Baikousi,Panos Vassiliadis		Distributed and Parallel Databases
2919405	MG-join: detecting phenomena and their correlation in high dimensional data streams.	Ibrahim Kamel,Zaher Al Aghbari,Thuraya Awad		Distributed and Parallel Databases
2919403	E-ARL: An Economic incentive scheme for Adaptive Revenue-Load-based dynamic replication of data in Mobile-P2P networks.	Anirban Mondal,Sanjay Kumar Madria,Masaru Kitsuregawa		Distributed and Parallel Databases
2919398	Beyond soundness: on the verification of semantic business process models.	Ingo Weber,Jörg Hoffmann,Jan Mendling		Distributed and Parallel Databases
2967523	Parallel processing of continuous queries over data streams.	Ali-Asghar Safaeei,Mostafa S. Haghjoo		Distributed and Parallel Databases
2967520	Replicating data objects in large distributed database systems: an axiomatic game theoretic mechanism design approach.	Samee Ullah Khan,Ishfaq Ahmad		Distributed and Parallel Databases
2967524	Efficient tracking of 2D objects with spatiotemporal properties in wireless sensor networks.	Guang Jin,Silvia Nittel		Distributed and Parallel Databases
2967529	SNEE: a query processor for wireless sensor networks.	Ixent Galpin,Christian Y. A. Brenninkmeijer,Alasdair J. G. Gray,Farhana Jabeen,Alvaro A. A. Fernandes,Norman W. Paton		Distributed and Parallel Databases
2967521	DYFRAM: dynamic fragmentation and replica management in distributed database systems.	Jon Olav Hauglid,Norvald H. Ryeng,Kjetil Nørvåg		Distributed and Parallel Databases
2967527	Query processing in sensor networks.	Erik Buchmann,Nesime Tatbul,Mario A. Nascimento		Distributed and Parallel Databases
2967522	Cardinality estimation and dynamic length adaptation for Bloom filters.	Odysseas Papapetrou,Wolf Siberski,Wolfgang Nejdl		Distributed and Parallel Databases
2967528	Power efficiency through tuple ranking in wireless sensor network monitoring.	Panayiotis Andreou,Demetrios Zeinalipour-Yazti,Panos K. Chrysanthis,George Samaras		Distributed and Parallel Databases
2967525	In-network data acquisition and replication in mobile sensor networks.	Panayiotis Andreou,Demetrios Zeinalipour-Yazti,Panos K. Chrysanthis,George Samaras		Distributed and Parallel Databases
2967526	Stream engines meet wireless sensor networks: cost-based planning and processing of complex queries in AnduIN.	Daniel Klan,Marcel Karnstedt,Katja Hose,Liz Ribe-Baumann,Kai-Uwe Sattler		Distributed and Parallel Databases
3067296	ASTERIX: towards a scalable, semistructured data platform for evolving-world models.	Alexander Behm,Vinayak R. Borkar,Michael J. Carey,Raman Grover,Chen Li,Nicola Onose,Rares Vernica,Alin Deutsch,Yannis Papakonstantinou,Vassilis J. Tsotras		Distributed and Parallel Databases
3067298	CorPN: managing instance correspondence in collaborative business processes.	Xiaohui Zhao,Chengfei Liu,Yun Yang,Wasim Sadiq		Distributed and Parallel Databases
3067295	Quantifying the trustworthiness of social media content.	Sai T. Moturu,Huan Liu		Distributed and Parallel Databases
3067297	Irregularity in high-dimensional space-filling curves.	Mohamed F. Mokbel,Walid G. Aref		Distributed and Parallel Databases
3067299	SEPL - a domain-specific language and execution environment for protocols of stateful Web services.	Waldemar Hummer,Philipp Leitner,Schahram Dustdar		Distributed and Parallel Databases
3067300	A decentralized deadlock detection and resolution algorithm for generalized model in distributed systems.	Selvaraj Srinivasan,Ramasamy Rajaram		Distributed and Parallel Databases
3166718	A human-centric runtime framework for mixed service-oriented systems.	Daniel Schall		Distributed and Parallel Databases
3166716	Scaling XML query processing: distribution, localization and pruning.	Patrick Kling,M. Tamer Özsu,Khuzaima Daudjee		Distributed and Parallel Databases
3166717	RFID enabled traceability networks: a survey.	Yanbo Wu,Damith Chinthana Ranasinghe,Quan Z. Sheng,Sherali Zeadally,Jian Yu		Distributed and Parallel Databases
3166715	Quality of experience in distributed databases.	Rogério Luís de Carvalho Costa,Pedro N. Furtado		Distributed and Parallel Databases
3271100	Pattern-based event detection in sensor networks.	Wenwei Xue,Qiong Luo,Hejun Wu		Distributed and Parallel Databases
3271101	Satisfaction-based query replication - An automatic and self-adaptable approach for replicating queries in the presence of autonomous participants.	Jorge-Arnulfo Quiané-Ruiz,Philippe Lamarre,Patrick Valduriez		Distributed and Parallel Databases
3271102	Business process model abstraction: a definition, catalog, and survey.	Sergey Smirnov,Hajo A. Reijers,Mathias Weske,Thijs Nugteren		Distributed and Parallel Databases
3401411	A new landscape for distributed and parallel data management.	Amit P. Sheth		Distributed and Parallel Databases
3401413	Dynamic routing of data stream tuples among parallel query plan running on multi-core processors.	Ali A. Safaei,Ali Sharifrazavian,Mohsen Sharifi,Mostafa S. Haghjoo		Distributed and Parallel Databases
3401412	Fast business process similarity search.	Zhiqiang Yan,Remco M. Dijkman,Paul W. P. J. Grefen		Distributed and Parallel Databases
3485482	MTCProv: a practical provenance query framework for many-task scientific computing.	Luiz M. R. Gadelha Jr.,Michael Wilde,Marta Mattoso,Ian T. Foster		Distributed and Parallel Databases
3485486	Combining CPU and GPU architectures for fast similarity search.	Martin Krulis,Tomás Skopal,Jakub Lokoc,Christian Beecks		Distributed and Parallel Databases
3485485	On optimality-ratio and coverage in ranking of joined search results.	Mirit Shalem,Yaron Kanza		Distributed and Parallel Databases
3485487	Distributed top-k full-text content dissemination.	Weixiong Rao,Lei Chen		Distributed and Parallel Databases
3485484	Distributed top-k query processing by exploiting skyline summaries.	Akrivi Vlachou,Christos Doulkeridis,Kjetil Nørvåg		Distributed and Parallel Databases
3485478	Data-intensive architecture for scientific knowledge discovery.	Malcolm P. Atkinson,Chee Sun Liew,Michelle Galea,Paul Martin,Amrey Krause,Adrian Mouat,Óscar Corcho,David Snelling		Distributed and Parallel Databases
3485489	Data challenges of time domain astronomy.	Matthew J. Graham,S. George Djorgovski,Ashish Mahabal,Ciro Donalek,Andrew J. Drake,Giuseppe Longo		Distributed and Parallel Databases
3485479	Guest Editor's editorial: ranking in databases.	Kaushik Chakrabarti		Distributed and Parallel Databases
3485488	High-performance short sequence alignment with GPU acceleration.	Mian Lu,Yuwei Tan,Ge Bai,Qiong Luo		Distributed and Parallel Databases
3485483	Special issue for data intensive eScience.	Judy Qiu,Dennis Gannon		Distributed and Parallel Databases
3485480	High-throughput query scheduling with spatial clustering based on distributed exponential moving average.	Beomseok Nam,Deukyeon Hwang,Jinwoong Kim,Minho Shin		Distributed and Parallel Databases
3485481	ROARS: a robust object archival system for data intensive scientific computing.	Hoang Bui,Peter Bui,Patrick J. Flynn,Douglas Thain		Distributed and Parallel Databases
3597259	Enhancing traceability of persistent data access flows in process-driven SOAs.	Christine Mayr,Uwe Zdun,Schahram Dustdar		Distributed and Parallel Databases
3597258	Personalized ranking in web databases: establishing and utilizing an appropriate workload.	Aditya Telang,Sharma Chakravarthy,Chengkai Li		Distributed and Parallel Databases
3597260	ART: sub-logarithmic decentralized range query processing with probabilistic guarantees.	Spyros Sioutas,Peter Triantafillou,George Papaloukopoulos,Evangelos Sakkopoulos,Kostas Tsichlas,Yannis Manolopoulos		Distributed and Parallel Databases
2998212	Strategic contributions of game rooms to knowledge management: some prelimenary insights.	Kevin C. Desouza		Information and Management
2998363	Beyond the information center: An instrument to measure end-user computing support from multiple sources.	Chittibabu Govindarajulu,Brian J. Reithel		Information and Management
2997925	The impacts of user review on software responsiveness: Moderating requirements uncertainty.	Jack Shih-Chieh Hsu,Chien-Lung Chan,Julie Yu-Chih Liu,Houn-Gee Chen		Information and Management
2998308	Requirements-driven data engineering.	Peter Aiken,Youngohc Yoon,Belkis Leong-Hong		Information and Management
2998326	An empirical investigation into the adoption of systems development methodologies.	Brian Fitzgerald		Information and Management
2997674	Selection of web sites for online advertising using the AHP.	E. W. T. Ngai		Information and Management
2998349	Electronic data interchange: a multi-industry investigation using grounded theory.	Connie W. Crook,Ram L. Kumar		Information and Management
2998440	A structural model of end user computing satisfaction and user performance.	Jamshid Etezadi-Amoli,Ali F. Farhoomand		Information and Management
2998488	Pre-physical data base design heuristics.	Narciso Cerpa		Information and Management
2997936	An auditing protocol for spreadsheet models.	Stephen G. Powell,Kenneth R. Baker,Barry Lawson		Information and Management
2998247	Output-driven information system planning: a case study.	Eldon Y. Li,Houn-Gee Chen		Information and Management
2998011	Strategic profiles and Internet Performance: An empirical investigation into the development of a strategic Internet system.	Charles H. Apigian,Bhanu S. Ragu-Nathan,T. S. Ragu-Nathan		Information and Management
2998404	Web sites of the Fortune 500 companies: Facing customers through home pages.	Chang Liu,Kirk P. Arnett,Louis M. Capella,Robert C. Beatty		Information and Management
2998088	Integrating perceived playfulness into expectation-confirmation model for web portal context.	Cathy S. Lin,Sheng Wu,Ray J. Tsai		Information and Management
2998275	User resistance and strategies for promoting acceptance across system types.	James J. Jiang,Waleed A. Muhanna,Gary Klein		Information and Management
2997688	An empirical investigation of KM styles and their effect on corporate performance.	Byounggu Choi,Heeseok Lee		Information and Management
2997717	Decision making performance of interacting groups: an experimental investigation of the effects of task type and communication mode.	Uday S. Murthy,David S. Kerr		Information and Management
2998096	The impact of service level on the acceptance of application service oriented medical records.	Liping Liu,Qingxiong Ma		Information and Management
2998188	Extended technology acceptance model of Internet utilization behavior.	Hung-Pin Shih		Information and Management
2997821	Strategic Out-Tasking: Creating "win-win" outsourcing partnerships.	Karthik Krishnamurthy,David Jegen,Bill Brownell		Information and Management
2997808	Decision support system for conflict diagnosis in personnel selection.	Miguel Nussbaum,Marcos Singer,Ricardo Rosas,Mariana Castillo,Errol Flies,Rodrigo Lara,Rodolfo Sommers		Information and Management
2998381	Evaluating security threats in mainframe and client/server environments.	Sherry D. Ryan,Bijoy Bordoloi		Information and Management
2998238	A multiple criteria assessment of decision technology system journal quality.	Guisseppi A. Forgionne,Rajiv Kohli		Information and Management
2998029	The role played by perceived usability, satisfaction and consumer trust on website loyalty.	Carlos Flavián,Miguel Guinaliu,Raquel Gurrea		Information and Management
2997767	Global information technology: a meta analysis of key issues.	Prashant C. Palvia,Shailendra C. Palvia,James Edward Whitworth		Information and Management
2998470	Factors used in the selection of packaged software in small businesses: Views of owners and managers.	Patrick Y. K. Chau		Information and Management
2997857	An intelligent multi-agent e-services method - An international telecommunication example.	Tung-Hsiang Chou,Jia-Lang Seng		Information and Management
2998395	Dynamic process modeling for BPR: A computerized simulation approach.	Hee-Woong Kim,Young-Gul Kim		Information and Management
2998481	Critical success factors in implementing MRP and government assistance: A Singapore context.	James S. K. Ang,Chee-Chuong Sum,Wah-Fook Chung		Information and Management
2998459	Cognitive evaluation of system representation diagrams.	Gerald L. Lohse,Daihwan Min,Judith Reitman Olson		Information and Management
2998422	Electronic publishing: A product architecture perspective.	Michael H. Zack		Information and Management
2997872	Threats and countermeasures for information system security: A cross-industry study.	Quey-Jen Yeh,Arthur Jung-Ting Chang		Information and Management
2998256	Does successful investment in information technology solve the productivity paradox?	Theophanis Stratopoulos,Bruce Dehning		Information and Management
2997692	E-business development for competitive advantages: a case study.	Dien D. Phan		Information and Management
2997703	Perception gaps between IS academics and IS practitioners: an exploratory study.	Sooun Lee,Seok Ha Koh,David C. Yen,Hung-Lian Tang		Information and Management
2998036	Deciding the financial health of dot-coms using rough sets.	Indranil Bose		Information and Management
2997694	Group decision support for public policy planning.	Willem J. H. Van Groenendaal		Information and Management
2997778	Electronic commerce in China: emerging success stories.	Maris G. Martinsons		Information and Management
2997896	The effects of change control and management review on software flexibility and project performance.	Eric T. G. Wang,Pei-Hung Ju,James J. Jiang,Gary Klein		Information and Management
2998321	The effects of user participation on the design of accounting information systems.	Jong-Min Choe		Information and Management
2998142	Beyond concern: a privacy-trust-behavioral intention model of electronic commerce.	Chang Liu,Jack T. Marchewka,June Lu,Chun-Sheng Yu		Information and Management
2998022	A procedure to design a structural and measurement model of Intellectual Capital: An exploratory study.	M. Rocío Martínez-Torres		Information and Management
2998265	Lessons learned from three interorganizational health care information systems.	Fay Cobb Payton		Information and Management
2998557	Implementing information technology for competitive advantage: Risk management issues.	Ronald E. McGaughey Jr.,Charles A. Snyder,Houston H. Carr		Information and Management
2998068	Separating the effects of knowledge construction and group collaboration in learning outcomes of web-based courses.	Raquel Benbunan-Fich,J. B. Arbaugh		Information and Management
2998108	What influences IT ethical behavior intentions - planned behavior, reasoned action, perceived importance, or individual characteristics?	Lori N. K. Leonard,Timothy Paul Cronan,Jennifer Kreie		Information and Management
2998303	Understanding corporate data models.	Graeme G. Shanks,Peta Darke		Information and Management
2998202	Trust-building mechanisms utilized in outsourced IS development projects: a case study.	Maria Cristina Lander,Russell L. Purvis,Gordon E. McCray,William Leigh		Information and Management
2998007	Parametric search engines: What makes them effective when shopping online for differentiated products?	Arnold Kamis,Edward A. Stohr		Information and Management
2998377	Exploring the research in information technology implementation.	Vincent S. Lai,Radha K. Mahapatra		Information and Management
2998463	Computer-aided software engineering: The determinants of an effective implementation strategy.	Robert Urwiler,Narender K. Ramarapu,Ronald B. Wilkes,Mark N. Frolick		Information and Management
2998025	The role of pleasure in web site success.	Kristof De Wulf,Niels Schillewaert,Steve Muylle,Deva Rangarajan		Information and Management
2998354	The impacts of presentation visuals on persuasion.	Joline Morrison,Doug Vogel		Information and Management
2997986	Students' participation intention in an online discussion forum: Why is computer-mediated interaction attractive?	Xue Yang,Yan Li,Chuan-Hoo Tan,Hock-Hai Teo		Information and Management
2997636	Identifying key factors affecting transnational knowledge transfer.	Yanqing Duan,Wanyan Nie,Elayne W. Coakes		Information and Management
